{
  "$schema": "../../schemas/nockapp-evm-chain-registry.schema.json",
  "version": "0.1.0",
  "generatedAt": "2026-06-08",
  "note": "Registry-driven chain profiles for the generalized cross-chain tester. family selects native hashes for xchain-hashlock-algo-match (EVM->keccak256/sha256, nock->tip5). recommendedMinConfirmations + confirmationBasis drive xchain-finality-model-mismatch / finality-adequacy. CONSERVATIVE values from verified profiles; for OP-stack/Arbitrum L2s the confirmationBasis is L1-batch (native-block counts are NOT safe), and optimistic-rollup chains additionally require the 7-day challenge window (xchain-challenge-window-respected). All EVM values are model inputs, not a live oracle.",
  "families": {
    "evm": { "nativeHashes": ["keccak256", "sha256"] },
    "nock": { "nativeHashes": ["tip5"] }
  },
  "chains": {
    "nockchain": {
      "chainId": 0,
      "name": "Nockchain",
      "family": "nock",
      "nativeHashes": ["tip5"],
      "finalityModel": "pow-tip5-stark",
      "recommendedMinConfirmations": 12,
      "confirmationBasis": "native",
      "challengeWindowSeconds": 0,
      "trustSoftConfirm": false,
      "reorgRisk": "medium",
      "confidence": "medium"
    },
    "1": {
      "chainId": 1,
      "name": "Ethereum mainnet",
      "family": "evm",
      "nativeHashes": ["keccak256", "sha256"],
      "finalityModel": "pos-2-epoch",
      "recommendedMinConfirmations": 15,
      "confirmationBasis": "native",
      "challengeWindowSeconds": 0,
      "trustSoftConfirm": false,
      "reorgRisk": "low",
      "confidence": "high"
    },
    "56": {
      "chainId": 56,
      "name": "BNB Smart Chain",
      "family": "evm",
      "nativeHashes": ["keccak256", "sha256"],
      "finalityModel": "posa-bft-fast-finality",
      "recommendedMinConfirmations": 15,
      "confirmationBasis": "native",
      "challengeWindowSeconds": 0,
      "trustSoftConfirm": false,
      "reorgRisk": "low",
      "confidence": "high"
    },
    "43114": {
      "chainId": 43114,
      "name": "Avalanche C-Chain",
      "family": "evm",
      "nativeHashes": ["keccak256", "sha256"],
      "finalityModel": "bft-snowman",
      "recommendedMinConfirmations": 1,
      "confirmationBasis": "native",
      "challengeWindowSeconds": 0,
      "trustSoftConfirm": false,
      "reorgRisk": "low",
      "confidence": "high"
    },
    "100": {
      "chainId": 100,
      "name": "Gnosis Chain",
      "family": "evm",
      "nativeHashes": ["keccak256", "sha256"],
      "finalityModel": "pos-2-epoch-gnosis",
      "recommendedMinConfirmations": 30,
      "confirmationBasis": "native",
      "challengeWindowSeconds": 0,
      "trustSoftConfirm": false,
      "reorgRisk": "medium",
      "confidence": "medium"
    },
    "42220": {
      "chainId": 42220,
      "name": "Celo",
      "family": "evm",
      "nativeHashes": ["keccak256", "sha256"],
      "finalityModel": "optimistic-rollup",
      "recommendedMinConfirmations": 12,
      "confirmationBasis": "L1-batch",
      "challengeWindowSeconds": 604800,
      "trustSoftConfirm": false,
      "reorgRisk": "low",
      "confidence": "high"
    },
    "137": {
      "chainId": 137,
      "name": "Polygon PoS",
      "family": "evm",
      "nativeHashes": ["keccak256", "sha256"],
      "finalityModel": "pos-checkpoint",
      "recommendedMinConfirmations": 128,
      "confirmationBasis": "native",
      "challengeWindowSeconds": 0,
      "trustSoftConfirm": false,
      "reorgRisk": "high",
      "confidence": "medium"
    },
    "10": {
      "chainId": 10,
      "name": "Optimism",
      "family": "evm",
      "nativeHashes": ["keccak256", "sha256"],
      "finalityModel": "optimistic-rollup",
      "recommendedMinConfirmations": 64,
      "confirmationBasis": "L1-batch",
      "challengeWindowSeconds": 604800,
      "trustSoftConfirm": false,
      "reorgRisk": "high",
      "confidence": "high"
    },
    "8453": {
      "chainId": 8453,
      "name": "Base",
      "family": "evm",
      "nativeHashes": ["keccak256", "sha256"],
      "finalityModel": "optimistic-rollup",
      "recommendedMinConfirmations": 65,
      "confirmationBasis": "L1-batch",
      "challengeWindowSeconds": 604800,
      "trustSoftConfirm": false,
      "reorgRisk": "high",
      "confidence": "medium"
    },
    "42161": {
      "chainId": 42161,
      "name": "Arbitrum One",
      "family": "evm",
      "nativeHashes": ["keccak256", "sha256"],
      "finalityModel": "optimistic-rollup",
      "recommendedMinConfirmations": 64,
      "confirmationBasis": "L1-batch",
      "challengeWindowSeconds": 604800,
      "trustSoftConfirm": false,
      "reorgRisk": "low",
      "confidence": "medium"
    },
    "42170": {
      "chainId": 42170,
      "name": "Arbitrum Nova",
      "family": "evm",
      "nativeHashes": ["keccak256", "sha256"],
      "finalityModel": "optimistic-rollup-anytrust",
      "recommendedMinConfirmations": 65,
      "confirmationBasis": "L1-batch",
      "challengeWindowSeconds": 604800,
      "trustSoftConfirm": false,
      "reorgRisk": "high",
      "confidence": "medium"
    },
    "81457": {
      "chainId": 81457,
      "name": "Blast",
      "family": "evm",
      "nativeHashes": ["keccak256", "sha256"],
      "finalityModel": "optimistic-rollup",
      "recommendedMinConfirmations": 64,
      "confirmationBasis": "L1-batch",
      "challengeWindowSeconds": 604800,
      "trustSoftConfirm": false,
      "reorgRisk": "medium",
      "confidence": "medium"
    },
    "34443": {
      "chainId": 34443,
      "name": "Mode",
      "family": "evm",
      "nativeHashes": ["keccak256", "sha256"],
      "finalityModel": "optimistic-rollup",
      "recommendedMinConfirmations": 64,
      "confirmationBasis": "L1-batch",
      "challengeWindowSeconds": 604800,
      "trustSoftConfirm": false,
      "reorgRisk": "medium",
      "confidence": "low"
    },
    "252": {
      "chainId": 252,
      "name": "Fraxtal",
      "family": "evm",
      "nativeHashes": ["keccak256", "sha256"],
      "finalityModel": "optimistic-rollup",
      "recommendedMinConfirmations": 65,
      "confirmationBasis": "L1-batch",
      "challengeWindowSeconds": 604800,
      "trustSoftConfirm": false,
      "reorgRisk": "high",
      "confidence": "medium"
    },
    "7777777": {
      "chainId": 7777777,
      "name": "Zora",
      "family": "evm",
      "nativeHashes": ["keccak256", "sha256"],
      "finalityModel": "optimistic-rollup",
      "recommendedMinConfirmations": 64,
      "confirmationBasis": "L1-batch",
      "challengeWindowSeconds": 604800,
      "trustSoftConfirm": false,
      "reorgRisk": "low",
      "confidence": "high"
    },
    "324": {
      "chainId": 324,
      "name": "zkSync Era",
      "family": "evm",
      "nativeHashes": ["keccak256", "sha256"],
      "finalityModel": "zk-validity-proof",
      "recommendedMinConfirmations": 0,
      "confirmationBasis": "L1-proof-verified",
      "challengeWindowSeconds": 0,
      "trustSoftConfirm": false,
      "reorgRisk": "low",
      "confidence": "high"
    },
    "1101": {
      "chainId": 1101,
      "name": "Polygon zkEVM (DEPRECATED)",
      "family": "evm",
      "nativeHashes": ["keccak256", "sha256"],
      "finalityModel": "deprecated-sunset",
      "recommendedMinConfirmations": 0,
      "confirmationBasis": "deprecated",
      "challengeWindowSeconds": 0,
      "trustSoftConfirm": false,
      "reorgRisk": "high",
      "confidence": "high"
    },
    "59144": {
      "chainId": 59144,
      "name": "Linea",
      "family": "evm",
      "nativeHashes": ["keccak256", "sha256"],
      "finalityModel": "zk-validity-proof",
      "recommendedMinConfirmations": 32,
      "confirmationBasis": "L1-proof-verified",
      "challengeWindowSeconds": 0,
      "trustSoftConfirm": false,
      "reorgRisk": "low",
      "confidence": "medium"
    },
    "534352": {
      "chainId": 534352,
      "name": "Scroll",
      "family": "evm",
      "nativeHashes": ["keccak256", "sha256"],
      "finalityModel": "zk-validity-proof",
      "recommendedMinConfirmations": 1,
      "confirmationBasis": "L1-proof-verified",
      "challengeWindowSeconds": 0,
      "trustSoftConfirm": false,
      "reorgRisk": "low",
      "confidence": "medium"
    },
    "167000": {
      "chainId": 167000,
      "name": "Taiko",
      "family": "evm",
      "nativeHashes": ["keccak256", "sha256"],
      "finalityModel": "based-contestable-rollup",
      "recommendedMinConfirmations": 95,
      "confirmationBasis": "L1-batch",
      "challengeWindowSeconds": 86400,
      "trustSoftConfirm": false,
      "reorgRisk": "medium",
      "confidence": "medium"
    },
    "5000": {
      "chainId": 5000,
      "name": "Mantle",
      "family": "evm",
      "nativeHashes": ["keccak256", "sha256"],
      "finalityModel": "zk-validity-proof",
      "recommendedMinConfirmations": 32,
      "confirmationBasis": "L1-proof-verified",
      "challengeWindowSeconds": 0,
      "trustSoftConfirm": false,
      "reorgRisk": "medium",
      "confidence": "medium"
    },
    "169": {
      "chainId": 169,
      "name": "Manta Network",
      "family": "evm",
      "nativeHashes": ["keccak256", "sha256"],
      "finalityModel": "optimistic-rollup",
      "recommendedMinConfirmations": 64,
      "confirmationBasis": "L1-batch",
      "challengeWindowSeconds": 259200,
      "trustSoftConfirm": false,
      "reorgRisk": "medium",
      "confidence": "high"
    },
    "204": {
      "chainId": 204,
      "name": "opBNB",
      "family": "evm",
      "nativeHashes": ["keccak256", "sha256"],
      "finalityModel": "optimistic-rollup",
      "recommendedMinConfirmations": 32,
      "confirmationBasis": "L1-batch",
      "challengeWindowSeconds": 604800,
      "trustSoftConfirm": false,
      "reorgRisk": "high",
      "confidence": "medium"
    },
    "2020": {
      "chainId": 2020,
      "name": "Ronin",
      "family": "evm",
      "nativeHashes": ["keccak256", "sha256"],